351,trevi nel lazio,frosinone,non mibact,omr,sistema pre.gio,,,,museo archeologico domenico antonio pierantoni,via eresio fertore,,castello caetani,3010.0,,,,,41.8755794,12.6115341
352,tuscania,viterbo,non mibact,,,,,,raccolta di montebello del maestro giuseppe cesetti,centro strada montebello 3,,,1017.0,761442695,,,,42.3550533,11.8011922
353,tuscania,viterbo,mibact,,,,,,museo archeologico nazionale,largo mario moretti 1,,c/o chiesa della madonna del riposo,1017.0,0761 436209,0761 436209,sba embeniculturali.it,htpp//etruriameridionale.beniculturali.it,42.421493100000006,11.8705543
354,vallepietra,roma,non mibact,,,,,,sale museali ex voto santuario santissima trinita valle pietra,santuario santissima trinita,vallepietra,santuario,20.0,774899084,774899084,p.vallepietratiscalinet.it,,41.9257111,13.230550099999999
355,viterbo,viterbo,non mibact,,,,,,confraternita ss.sacramento e s.rosario,piazza oratorio 5,frazione s. martino al cimino,abbazia cistercense di s.martino al cimino,1100.0,761379301,,confraternitasanmartinogmail.com,www.abbaziasanmartinoalcimino.it,42.4157698,12.113354
356,viterbo,viterbo,mibact,,,,,,area archeologica antica citt di ferento,strada provinciale teverina km 8000,,,1100.0,,,,,42.4206766,12.107669
